{
  "id": "top-10-validation-fixture",
  "scopeId": "football.world-cup",
  "compatibleChallengeTypeIds": ["top-10"],
  "patternId": "poison-deck",
  "prompt": {"ar": "أي من هذه المنتخبات يقع ضمن أعلى 10 وفق الترتيب المحدد؟"},
  "answerMode": "top_10",
  "interactionPayload": {
    "variant": "poison-deck",
    "title": "أعلى 10 منتخبات",
    "rankingBasis": "موضع المنتخب في ترتيب الاختبار الرسمي",
    "sourceLabel": "مصدر اختبار رسمي",
    "sourceUrl": "https://example.com/official-ranking-fixture",
    "asOfDate": "2026-08-04",
    "candidates": [
      {"id": "candidate-01", "label": "المنتخب 1"},
      {"id": "candidate-02", "label": "المنتخب 2"},
      {"id": "candidate-03", "label": "المنتخب 3"},
      {"id": "candidate-04", "label": "المنتخب 4"},
      {"id": "candidate-05", "label": "المنتخب 5"},
      {"id": "candidate-06", "label": "المنتخب 6"},
      {"id": "candidate-07", "label": "المنتخب 7"},
      {"id": "candidate-08", "label": "المنتخب 8"},
      {"id": "candidate-09", "label": "المنتخب 9"},
      {"id": "candidate-10", "label": "المنتخب 10"},
      {"id": "candidate-11", "label": "المنتخب 11"},
      {"id": "candidate-12", "label": "المنتخب 12"},
      {"id": "candidate-13", "label": "المنتخب 13"},
      {"id": "candidate-14", "label": "المنتخب 14"}
    ],
    "teamCount": 2,
    "turnCount": 14,
    "turnDeadlineSeconds": 6,
    "actions": ["KEEP", "POISON"],
    "timeoutAction": "KEEP"
  },
  "resolutionPayload": {
    "rankedEntries": [
      {"candidateId": "candidate-01", "rank": 1},
      {"candidateId": "candidate-02", "rank": 2},
      {"candidateId": "candidate-03", "rank": 3},
      {"candidateId": "candidate-04", "rank": 4},
      {"candidateId": "candidate-05", "rank": 5},
      {"candidateId": "candidate-06", "rank": 6},
      {"candidateId": "candidate-07", "rank": 7},
      {"candidateId": "candidate-08", "rank": 8},
      {"candidateId": "candidate-09", "rank": 9},
      {"candidateId": "candidate-10", "rank": 10}
    ],
    "decoyCandidateIds": ["candidate-11", "candidate-12", "candidate-13", "candidate-14"],
    "revealOrder": "rank_10_to_1_then_decoys",
    "validOwnedCardValue": 1,
    "decoyOwnedCardValue": -1,
    "poisonBonus": 0,
    "scoringRuleId": "top10.poison-deck.result",
    "winnerScoreEventType": "top10.poison-deck.win",
    "tieScoreEventType": null,
    "socialMetricIds": ["successfulPoison", "giftedValidCard", "selfKeptDecoy", "selfKeptValid"]
  },
  "media": null,
  "isReusableAcrossSessions": false,
  "metadata": {
    "sources": ["https://example.com/official-ranking-fixture"],
    "validationStatus": "draft",
    "explanation": "Synthetic schema fixture; not production content.",
    "decoyReview": [
      {"candidateId": "candidate-11", "cutoffDistance": 1, "plausibility": "Immediately below cutoff.", "tooEasy": false},
      {"candidateId": "candidate-12", "cutoffDistance": 2, "plausibility": "Near-cutoff candidate.", "tooEasy": false},
      {"candidateId": "candidate-13", "cutoffDistance": 3, "plausibility": "Near-cutoff candidate.", "tooEasy": false},
      {"candidateId": "candidate-14", "cutoffDistance": 4, "plausibility": "Adjacent source range.", "tooEasy": false}
    ]
  }
}
